,product_id,product_title,rating,summary,review,name,location,date,upvotes,downvotes
83,ACCEZ3YWU75CERHH,ZEBRONICS ZEB-KM-2100 Wired USB Desktop Keyboard,5,Excellent,Good,Bhanuchandhar  G J,Chennai,"Jul, 2018",9,1
270,AICGYH26HGMFGEBF,Hindware Snowcrest 45 L Room/Personal Air Cooler,5,Highly recommended,Super super,malli karjuna,Mantralayam,"Mar, 2021",3,0
73,ACCGYWFK2JE2BJR8,"GoldKart Back Cover for Samsung Galaxy M12, Samsung Galaxy A12, Samsung Galaxy F12",5,Just wow!,Nice Looking,Abbas Bahi,Ambur,7 months ago,3,0
697,AICEQUFHBKNF5U4T,Symphony 12 L Room/Personal Air Cooler,1,Useless product,"Product was old.it has rust on screws,fungas on machine.flipkart service was very good,got my money return.but delivery boy was also very rude..worst product i got..",Santosh kumar,Mumbai,"Mar, 2018",2,0
1040,AICGC6YYNZJHZTCA,CROMPTON 75 L Desert Air Cooler,1,Absolute rubbish!,Water pump was not working.,ROHAN  RATNA ,Saharsa,"Jun, 2019",5,0
794,ACCFAHEZ9HEFPHMG,Glink GLM69 Wired Optical Mouse,5,Super!,Supp,Brajesh Behera,Bangalore Urban,3 months ago,0,0
625,ACCEGVTXGKZDXFRX,AMKETTE Xcite Neo Mouse & Wired USB Laptop Keyboard,5,Perfect product!,WonderFul Smooth Touch No Immitations Or Consort Ism s Construct is Well Light Non Heavy And Gives Off Great Immaculate Accuracy Speeds Unbound Perfect Ten Type Out Use Out And Wear Insist And Use Daily To Daily When Ever Requireds Thank You ...,Damien Dsouza,Mumbai,"Dec, 2017",0,0
230,AICFFGJZTHSDN3AZ,Symphony 27 L Room/Personal Air Cooler,1,Worst experience ever!,Bad product,Krishna Mohan Kumar,Dighwara,24 days ago,2,1
394,ACCFG3ACAXXHHRHW,"SRT Back Cover for Apple iPhone 7, Apple iPhone 8",5,Mind-blowing purchase,Nice product,Dip Maity,Thrissur,"Nov, 2020",0,0
382,AICFFVVJFQHHNCN8,CROMPTON 88 L Desert Air Cooler,1,Waste of money!,"Plastic material very very bed . And air thro only singal bad use . Cooler tyre damage after 9 day , don't purchase vest money",Mamta ,Jaipur District,9 months ago,0,0
775,AICFERMY7WWWAZYZ,Hindware Calisto 50 L Desert Air Cooler,5,Must buy!,5star super,Aslam Shaikh,Surat,"Mar, 2021",1,0
60,AICERF3ZMFAYK4ZC,Hindware 85 L Desert Air Cooler,5,Highly recommended,"amazing cooler working well and great thing is feelling cold in 45 degrees air throw is very nice , even in low blow mode its perfectly helping to chill out surroundings . thank u flipkart and hindware.",Amit  Ojha ,Guna,"May, 2019",3,1
237,AICFFGJZTHSDN3AZ,Symphony 27 L Room/Personal Air Cooler,3,Does the job,"Height of the cooler is very small...fan speed at low and medium option gives less air flow...at high speed, you can feel some coolness...wheels are very thin....cooler is very light weight",ASHWIN  BELURE ,Ballari,"Mar, 2021",5,5
501,ACCFXUAB8YXRXTDF,"SHINESTAR. Back Cover for Apple iPhone 7 Plus, Apple iPhone 8 Plus",5,Perfect product!,The produt is good for iphone 7 plus and i will recommend this to iphone 7 plus users but in the bak i had some bubbles in my cover…. Thats ok its a plastic….,Kaviyanandan V,Kalkurichi,9 months ago,0,0
236,ACCFX6XRVG54GWXH,"Casewilla Back Cover for Apple iPhone 12, Plain, Cover",5,Classy product,Good,GURBAKSH SINGH,Bengaluru,8 months ago,0,0
882,AICERF3ZUEZPUWFK,Hindware 36 L Room/Personal Air Cooler,1,Unsatisfactory,"Worst cooler ever used. We had symphony diet 22lt in one room, which is working very good and cools the room in 30 mins. But this one will not even cool the room after 4 hours also. It's very noisy. Prices also comparative the same to Symphony. My suggestion is better go with Symphony.We buy cooler for cool breeze but this is no way related to cool Breeze, instead of using this better use a ceiling fan.",Abhishek kollipara,Bengaluru,"Apr, 2017",215,240
8,ACCFBPGHR8HWPHUF,HP 1000 Wired Optical Mouse,4,Wonderful,I got this for 299.For that price this is a great mouse. Smooth and accurate. Before buying this  I owned a Logitech's mouse which was not that great compared to that this is a great mouse.i am not downgrading logitech that was an old mouse so it was hard to use....I like the glossy desgin of the mouse and bulky shape is also good for handling the mouse and its so light weight...Overall hp's this mouse is a great option for buying for an average user,Cyril Sunil,Kuthiathode,"Jun, 2020",15,4
36,ACCGFWY43WADZC5E,GadgetM Back Cover for Apple Iphone 12,5,Classy product,Nice,vishal lamba,Hariana,1 month ago,0,0
58,ACCGFWY43WADZC5E,GadgetM Back Cover for Apple Iphone 12,4,Delightful,Good,Sudhanshu Sahoo,Mayurbhanj District,2 months ago,0,0
653,ACCG9BV88N3KXKJH,KartV Back Cover for Apple Iphone 11,5,Great product,Best,Pradip Kishari,Chandauli,1 month ago,0,1
469,ACCFZZ8GZPFHFGTM,Case Club Back Cover for Samsung Galaxy M12,5,Excellent,Osm back cover.....its nice smooth....,Nitai  Roy,Paschim Medinipur District,7 months ago,33,24
301,ACCFBZGVBKU3MNFY,HP 100 Wired USB Desktop Keyboard,5,Mind-blowing purchase,Good,Mohammad Ajharuddin,Uttar Dinajpur District,1 month ago,0,0
438,ACCGFXRTYWXRWA4T,"CEDO Flip Cover for Samsung Galaxy F12, Samsung Galaxy M12, Samsung Galaxy A12",3,Good,The product was ok and was well suited for my Samsung A12. PROS:1. Prompt and responsible delivery2. Recieved the product in good condition3. The flip cover is good looking and offers good protection to our device.CONS:1. The holes for charging port and headphone jack were   not perfectly cut out and it took some effort to connect the charger and the headphone. Even if we slightly move the device the charger/headphone connection would be lost.2.  The fingerprint area also have the sa...,Arjun Thulaseedhar,Thodupuzha,5 months ago,0,0
1147,AICFNNBW9EB2S9ZA,Symphony 55 L Tower Air Cooler,1,Terrible product,This cooler waste waste waste product. I am suffering for this pordut. Iam not happy cooler is not cooling,Narsinga  Karthik,Mahabubabad,10 months ago,3,1
254,ACCGFXRUUQEYMRKA,"CEDO Flip Cover for Samsung Galaxy F12, Samsung Galaxy M12, Samsung Galaxy A12",4,Value-for-money,Not bad,Bala Sankar,Tirunelveli,8 months ago,0,1
381,ACCFG3ACAXXHHRHW,"SRT Back Cover for Apple iPhone 7, Apple iPhone 8",5,Mind-blowing purchase,Nice cover,Bimal kumar jena ,Jajapur District,4 months ago,0,0
212,ACCFDK469A9W96HJ,ZEBRONICS Zeb-K20 Wired USB Desktop Keyboard,4,Nice product,It is the best but the price does not match with it. 😞😞😞,Avaya  Mohapatra,Kamakshyanagar,"Aug, 2020",1,0
1031,AICGC6YYNZJHZTCA,CROMPTON 75 L Desert Air Cooler,5,Best in the market!,very nice cooler and cooling very fast and plastic body is durable,Gourav Malviya ,Abu Road,"May, 2018",53,16
496,ACCEHDYAKFAJ7EYQ,DELL KB 216 Wired USB Desktop Keyboard,5,Must buy!,"Excellent product, must buy.",Saikat Samanta,Hugli District,"Aug, 2020",3,0
470,ACCEHDYAKFAJ7EYQ,DELL KB 216 Wired USB Desktop Keyboard,3,Decent product,Good product but keys are harder. Not suitable for typing long essays because fingers would get painful. I prefer my laptop keyboard to this.,Gokul Kannan,Bengaluru,"Feb, 2019",0,1
31,ACCFZUG7KF9ATX9H,"Casotec Back Cover for Samsung Galaxy M12, Samsung Galaxy A12, Samsung Galaxy F12 Clear TPU Case",5,Terrific purchase,Perfect,Rahul sagar,Karimnagar,3 months ago,0,0
335,AICFFVVJFQHHNCN8,CROMPTON 88 L Desert Air Cooler,5,Worth every penny,"Best in the classExtremely light and awesome looks and very easy to maneuver around thanks to the 4 wheels at each corner with wheel locking feature. Talking about its main function that is cooling ,so let me tell you it worth every penny and cools the room in around 10 min of medium size .It got 5  iron blades which works fine and tank capacity is very large .I would recommend go for the lower capacity which would cost 1000 rupees less.",Shubham Sanket,Patna,11 months ago,6,3
132,ACCFYV8ZGVEM4DVE,GadgetM Back Cover for Apple Iphone 11,5,Awesome,Good,Kaushik,Mangaluru,24 days ago,0,0
588,AICEQVHUD9VZC4EG,Orient Electric 20 L Room/Personal Air Cooler,4,Value-for-money,good quality,Durga rao Dasari,Eluru,"May, 2019",12,5
1032,AICGC6YYNZJHZTCA,CROMPTON 75 L Desert Air Cooler,1,Very poor,"Which purchase  , it's defective . It's been 10 days but replacement is still pending . Everyday you ate giving some or other reasons .Poorest response from flipkart.Being plus member and assured product by Flipkart , I am getting so helpless but I will not spare u guys till u replace it.",vishal  singh,New Delhi,11 months ago,6,0
1211,AICEQUFHVJGGHPMV,Symphony 35 L Tower Air Cooler,3,Fair,good cooler. easy to move and takes less space in the room but the cooling is not up to mark..as expected. it's suitable for a small room size 10x10 or less.,Amit tiwari,Greater Noida,"Jun, 2018",2,0
43,ACCFZUG7KF9ATX9H,"Casotec Back Cover for Samsung Galaxy M12, Samsung Galaxy A12, Samsung Galaxy F12 Clear TPU Case",5,Awesome,Nice,Arup Halder,Beldanga,4 months ago,0,0
360,AICFFVVJFQHHNCN8,CROMPTON 88 L Desert Air Cooler,3,Nice,"After 1 month review motor is slow and dead. We push or pull the fan of motor to start. This is too bad from Crompton cooler, i am not accepting from Crompton cooler",Ashish Kumar,New Delhi,"Jul, 2019",5,1
445,AICFQV87NFUG595H,CROMPTON 40 L Room/Personal Air Cooler,1,Absolute rubbish!,No cooling at all...wastage of money... please don't buy this ...,Debdyuti Ghosh,Panihati,"Apr, 2021",1,1
546,ACCF47WBREUAVYHH,SHINESTAR. Back Cover for Apple iPhone 6s,4,Very Good,Good product,Md. Nasir,Indore,4 months ago,0,0
2,COMFUZ3JZVNCPJFU,ALIENWARE Core i7 10th Gen - (16 GB/1 TB SSD/Windows 10 Home/6 GB Graphics/NVIDIA GeForce RTX 2060/300 Hz) M15R3 / AWM15R3 Gaming Laptop,5,Mind-blowing purchase,worth,Rakeshraj A,Melur,"Nov, 2020",22,35
708,AICEQUFHBKNF5U4T,Symphony 12 L Room/Personal Air Cooler,4,Wonderful,"minimum cooling and it's enough for maximum two persons,water will last only for few hours and cool air will flow for 5-6 hours with full tank filled,and it has air flow control speed and swing option",karthik eswaran,Puducherry,"Jun, 2019",2,0
20,ACCFBPGHR8HWPHUF,HP 1000 Wired Optical Mouse,4,Really Nice,I wish the mouse was a bit bigger so that it would have been easier for me to move around. It's a bit too small for me. The optical sensor is very good though and works perfectly all the time.,Soumilak  Jana ,Kolkata,"Mar, 2020",0,0
1291,AICFNMDBXVAQMBVS,Symphony 80 L Desert Air Cooler,5,Terrific purchase,Very good,Vineet  Mishra,Jabalpur,11 months ago,1,0
1512,AICEQVHUGDDBYF6K,Orient Electric 50 L Window Air Cooler,3,Decent product,Good,Manoj Chetry,Malbazar,1 day ago,0,0
1413,AICESQCZZVR3CMBM,Symphony 55 L Room/Personal Air Cooler,1,Terrible product,No cooling coming,Khaja Khan,Guntur District,10 months ago,0,0
493,ACCFXUAB8YXRXTDF,"SHINESTAR. Back Cover for Apple iPhone 7 Plus, Apple iPhone 8 Plus",4,Good choice,good fit and quality,anandhu ar,Alappuzha District,4 months ago,0,0
270,ACCEQH83EUNCY3CV,SHINESTAR. Back Cover for Apple iPhone 6s,4,Really Nice,very good for the price,Parvez Alam,Jajapur,9 months ago,0,0
149,ACCFRWVBWVBHHCXG,"KWINE CASE Back Cover for Samsung Galaxy F41, Samsung Galaxy M31, Samsung Galaxy M21 2021",3,Good,Ok best,prasanta saha,Raiganj,8 days ago,0,0
391,ACCFH7H8FG6GZMKB,"Flipkart SmartBuy Back Cover for Samsung Galaxy A20, Samsung Galaxy A30, Samsung Galaxy M10S",5,Worth every penny,good,shanu  shanu,Neyyattinkara,8 months ago,0,0
603,AICEQVHUD9VZC4EG,Orient Electric 20 L Room/Personal Air Cooler,5,Brilliant,Decent product 👌. worth,Laxman Lucky,Hyderabad,"Apr, 2021",2,0
419,ACCFBDCVVNXUWBXH,ZEBRONICS Zeb-Judwaa 750 Keyboard & Mouse Combo Wired USB Desktop Keyboard,4,Really Nice,Good product,Arjun Prajapati,Sultanpur,"Apr, 2021",1,0
78,ACCFBPGHR8HWPHUF,HP 1000 Wired Optical Mouse,1,Waste of money!,"Useless product, Got defect only after 1 week use",Praveen  PG,Davanagere,"Mar, 2020",0,0
909,AICERF3ZUEZPUWFK,Hindware 36 L Room/Personal Air Cooler,4,Good quality product,Very good product with good cooling,Mohd Shahid,Kanpur,"May, 2018",48,15
216,ACCFX6XRVG54GWXH,"Casewilla Back Cover for Apple iPhone 12, Plain, Cover",1,Don't waste your money,Turns yellow after 2-3 days using,SOUMYADIP GHARAI,Purba Medinipur District,4 months ago,0,0
99,ACCEZ3YWU75CERHH,ZEBRONICS ZEB-KM-2100 Wired USB Desktop Keyboard,5,Fabulous!,Good I am emprae,Punam pukar Punam pukar,Dhanbad,10 months ago,1,0
34,ACCFZUG7KF9ATX9H,"Casotec Back Cover for Samsung Galaxy M12, Samsung Galaxy A12, Samsung Galaxy F12 Clear TPU Case",4,Delightful,Good quality,Md. Kamrujjaman,Maldah District,3 months ago,0,0
5,ACCGFWY43WADZC5E,GadgetM Back Cover for Apple Iphone 12,5,Great product,It’s Awesome,Avinash kumar,Gaya,2 days ago,0,0
252,ACCEQH83EUNCY3CV,SHINESTAR. Back Cover for Apple iPhone 6s,5,Simply awesome,Delivery person so good Product are so nice 👌🏻 Thanks you Flipkart,sudipta das,Berhampore,1 month ago,0,0
65,ACCFBPGHR8HWPHUF,HP 1000 Wired Optical Mouse,1,Terrible product,Scroll not working,Abdul Shaikh,Mumbai,"Aug, 2020",0,0
214,ACCGFXRUUQEYMRKA,"CEDO Flip Cover for Samsung Galaxy F12, Samsung Galaxy M12, Samsung Galaxy A12",4,Nice product,Good,Ramesh Das,Howrah,1 month ago,0,0
819,AICFYNG9D7JTYFZE,Symphony 70 L Desert Air Cooler,1,Utterly Disappointed,Don't purchase please,amanullah shaik,Badvel,10 months ago,3,1
397,ACCGFXRTYWXRWA4T,"CEDO Flip Cover for Samsung Galaxy F12, Samsung Galaxy M12, Samsung Galaxy A12",3,Nice,Ok good,Mohammad shakir ,New Delhi,11 days ago,0,0
503,AICEQGBHB75HSWGG,CROMPTON 75 L Desert Air Cooler,5,Perfect product!,"Cooler is excellant giving air upto 15 feet in the room size 12*15 feet.Good design with no water leaks. 3speeds ,even good cooling at lowest speed and used in summer with 40 deg C. Noise is more,but bearable. Honey comb mat is added advantage.As per specs it consumes 190 watts.Movement is easy with castor wheels. Electric chord length is only one meter.overall best cooler in it’s range .Recommanded to others.I A Rao.",I A RAO,Hyderabad,"May, 2019",8,5
1159,AICFNNBW9EB2S9ZA,Symphony 55 L Tower Air Cooler,4,Nice product,Nice And Silent performance and,Shivam Jaiswal,Azamgarh District,10 months ago,1,0
626,ACCEGVTXGKZDXFRX,AMKETTE Xcite Neo Mouse & Wired USB Laptop Keyboard,5,Classy product,very good product and soft key and good locking key nice product,Haidar  Ali,Khajuraho,"Oct, 2017",0,0
550,ACCF5Q2FBDBUZPAU,"Logitech M221 / Silent Buttons, 1000 DPI Optical Tracking, Ambidextrous Wireless Optical Mouse",5,Mind-blowing purchase,Not recommended for those who like the bigger one,Hriat Zuala,Darjeeling,"Mar, 2021",0,0
612,ACCERQGMQCQFXGHC,GoldKart Back Cover for Apple iPhone 6 GOLDCASE-701,4,Good choice,Little loose,Kongara Harish,Hyderabad,"Feb, 2021",0,0
1372,AICESQCZZVR3CMBM,Symphony 55 L Room/Personal Air Cooler,5,Worth every penny,Very nice coolar very good performance,Azeem  Siddiqui ,Panipat,"May, 2019",10,5
1163,AICFNNBW9EB2S9ZA,Symphony 55 L Tower Air Cooler,2,Expected a better product,Good,suhail suhail,Bengaluru,11 months ago,1,0
630,ACCEGVTXGKZDXFRX,AMKETTE Xcite Neo Mouse & Wired USB Laptop Keyboard,1,Not recommended at all,"Worst Experience ever.. These peripherals automatically started deleting my files and folders.How? I don't know. They perfectly worked for few days and then it started happening like this. Don't buy these Chinese brand. Go for any Indian one like Prodot etc. Or Flipkart smartbuy. If you're able to go for good brands like Hp, Dell then must go for it.",Rajesh Kumar,Deoghar,9 months ago,2,15
803,AICFYNG9D7JTYFZE,Symphony 70 L Desert Air Cooler,5,Great product,Best one cooling is awesome every thing is perfect 👌Don't wait just go for it,Ankit Kumar,Banka,11 months ago,7,1
875,AICFYNG9D7JTYFZE,Symphony 70 L Desert Air Cooler,5,Must buy!,Awesome,Rahul Singh,Rohtas District,23 days ago,0,0
419,AICFQV87NFUG595H,CROMPTON 40 L Room/Personal Air Cooler,5,Fabulous!,super cooling,Iqbalsha Diwan,Ahmedabad,"Mar, 2021",9,3
1581,AICFCMRDPJ4DK4ZD,Flipkart SmartBuy 30 L Tower Air Cooler,5,Fabulous!,Omg this is so perfect like literally in live with this product the air throw is incredible I love it,Somya Singh,Ghaziabad,"Mar, 2021",0,0
22,ACCFZUG7KF9ATX9H,"Casotec Back Cover for Samsung Galaxy M12, Samsung Galaxy A12, Samsung Galaxy F12 Clear TPU Case",5,Super!,Nice and transparent cover made from pvc,Ratan priya Pathak,Patna,1 month ago,0,0
1407,AICESQCZZVR3CMBM,Symphony 55 L Room/Personal Air Cooler,1,Waste of money!,Cooling is not good and very costly,Vipin  Kumar ,Shahabad Hardoi District,8 months ago,0,0
995,AICGC6YYNZJHZTCA,CROMPTON 75 L Desert Air Cooler,1,Utterly Disappointed,"Never purchase cooler from FlipkartMy 10500 wastedPump not working, honey comb dry,not giving cool air,the up and down slider is also not working when you manually do it up it Will go down itself after few minutes giving only air in downwardI am a regular Flipkart customer and was trusting Flipkart but after this cooler purchasing experience i hate Flipkart from now and I'll never do any order at FlipkartI've requested for return that was 7 days replacement policy butTechnician came and...",HAFIZUR,Asansol,8 days ago,5,3
868,ACCES6YFGJFF7GFJ,QUANTUM QHM7307 MINI MULTIMEDIA KEYBOARD Wired USB Multi-device Keyboard,2,Moderate,In Broken condition keyboard,Abdul Rahman,Nanded,"Sep, 2018",6,2
229,ACCGFXRUUQEYMRKA,"CEDO Flip Cover for Samsung Galaxy F12, Samsung Galaxy M12, Samsung Galaxy A12",4,Nice product,Cover was good.,Mohan M,Kattuputhur,4 months ago,0,0
1586,AICFCMRDPJ4DK4ZD,Flipkart SmartBuy 30 L Tower Air Cooler,5,Just wow!,"after 2 days of usage, i can say its good product. Throws very good air. Small and compact with all features.",Neerav Garg,Gurugram,"Jun, 2019",0,1
335,ACCGFWY2ARNJDAJG,GadgetM Back Cover for Apple Iphone 12,4,Nice product,nice fit nd finishing.. go for it,Amit Ammu,Dehradun,1 month ago,0,0
1056,AICFYNGFPPNRM8FG,Symphony 27 L Room/Personal Air Cooler,5,Highly recommended,Really it's nice working thing guy's. Truly suggested to purchase.service about it good.i will give 100 out of 100 for this product.,Praveen Lad,Badlapur,10 months ago,0,0
1450,AICEQVHUGDDBYF6K,Orient Electric 50 L Window Air Cooler,5,Must buy!,Good product... Looking like AC. COOLING AS MEDIUM OVER ALL GOOD COOLER.,varinder singh,Phagwara,11 months ago,3,0
1268,AICEQUFHVJGGHPMV,Symphony 35 L Tower Air Cooler,5,Best in the market!,Nice cooler I don't see this market I love Flipkart,Anas Khan,Bhopal,"Jun, 2017",0,1
19,CKBFS9J6XWHSSQRJ,Chaayos Chai Time Snack Chocochip Cookies Cookies,1,Don't waste your money,Very expensive and feels heavy aftr having it,Monisha  A,Jamshedpur,9 months ago,0,0
422,ACCFB5RHGC5NYGV9,SUNSHINE Back Cover for Apple iPhone 7,5,Awesome,Osm looks very good,Gitesh Kumar,Bilaspur,"Nov, 2020",0,0
620,AICEQVHUD9VZC4EG,Orient Electric 20 L Room/Personal Air Cooler,4,Worth the money,Super filpkart,Karthik Rks,Vellore,"Mar, 2020",3,1
1547,AICFCMRDPJ4DK4ZD,Flipkart SmartBuy 30 L Tower Air Cooler,5,Worth every penny,"First the product is made in India and the quality is very good , impressive . The cooler is great and value for money at this price range . It can also beat symphony cooler . The product working is also Good . Thanks flipkart . 😀",Ravi  Kumar,Rohtak,"May, 2020",2,2
151,CKBET6WU5APC49HS,BRITANNIA NutriChoice Digestive High Fibre Biscuits Digestive,5,Perfect product!,Very nice,Rinki singh Rinki,Noida,1 month ago,0,0
907,ACCES6YFGJFF7GFJ,QUANTUM QHM7307 MINI MULTIMEDIA KEYBOARD Wired USB Multi-device Keyboard,5,Terrific,Nice product,Jignesh  patel,Navsari,1 month ago,0,0
101,ACCGYWFK2JE2BJR8,"GoldKart Back Cover for Samsung Galaxy M12, Samsung Galaxy A12, Samsung Galaxy F12",3,Just okay,Good product,Supriya ghorui hajra  Ghorui Hajra ,Hugli District,5 months ago,0,0
930,ACCES6YFGJFF7GFJ,QUANTUM QHM7307 MINI MULTIMEDIA KEYBOARD Wired USB Multi-device Keyboard,5,Worth every penny,Excellent product,Shrimad Mishra,Bengaluru,5 months ago,0,0
347,ACCE94WY6QPXKXFN,HP C2500 Wired Combo keyboard and Mouse,5,Terrific,water registan good keyboard,Sksahil Hassan,Purba Medinipur District,"Jul, 2018",142,20
1533,AICFCMRDPJ4DK4ZD,Flipkart SmartBuy 30 L Tower Air Cooler,2,Bad quality,"I am reviewing here ater using 7 days. It will be a waste of money if you purchased it for a 100 cubic feet room but yes, good for one person use, can get air only on one single bed when you keep it nearby your bed. You can't expect cooling even you use ice in ice chamber. I think it can be useful for the place where tempreture is 40+ and very low humidity where you can feel difference in room temperature when you enter in your room but totally wastage for below 40 temperature and high humidi...",Vivek Mishra,Greater Noida,"Jul, 2019",13,7
1495,AICEQVHUGDDBYF6K,Orient Electric 50 L Window Air Cooler,4,Very Good,Good product and nice cooling,Rohit  Kumar,Patna,10 months ago,1,0
1393,AICESQCZZVR3CMBM,Symphony 55 L Room/Personal Air Cooler,5,Excellent,"Very minimal noise, good performance if place near open space. Overall good product.",Wasim Alam,Hyderabad,"Apr, 2018",3,0
39,ACCFBPGHR8HWPHUF,HP 1000 Wired Optical Mouse,1,Terrible product,Don't buy it. after few month's the scroller stoped working..,Parag R,Pune,"Jul, 2019",6,1
593,AICEQVHUD9VZC4EG,Orient Electric 20 L Room/Personal Air Cooler,5,Terrific purchase,Good product...,Duke Arora,New Delhi,"Jun, 2017",3,0
1403,AICESQCZZVR3CMBM,Symphony 55 L Room/Personal Air Cooler,5,Best in the market!,Nice one,Surender  Tomer,New Delhi,"Feb, 2019",2,0
553,ACCF5Q2FBDBUZPAU,"Logitech M221 / Silent Buttons, 1000 DPI Optical Tracking, Ambidextrous Wireless Optical Mouse",5,Great product,Excellent mouse,Chaitanya Vikram,Visakhapatnam,"Mar, 2021",0,0
92,ACCGFCHVGTWSHZYU,GadgetM Back Cover for Apple iPhone XR,5,Terrific,Very Good Quality.,Priya Customer,Kolkata,7 months ago,0,0
569,ACCF5Q2FBDBUZPAU,"Logitech M221 / Silent Buttons, 1000 DPI Optical Tracking, Ambidextrous Wireless Optical Mouse",3,Does the job,"Nice product, the speed might be less. Has on off switch. But the price declined after my purchase. Right and left buttons are silent but the scroll wheel is not. Could be better if given with bluetooth connectivity along with USB.",Vivek G Bhat,Mudbidri,19 days ago,0,0
137,ACCEZ3YWU75CERHH,ZEBRONICS ZEB-KM-2100 Wired USB Desktop Keyboard,5,Classy product,Very good product at this price..,Shobit,Behta Hajipur,"May, 2019",1,0
1246,AICEQUFHVJGGHPMV,Symphony 35 L Tower Air Cooler,1,Waste of money!,Bad product.Don't buy this product 👎,Shubhankar Singh,Faridabad,8 days ago,0,0
280,ACCG9NHFHGUSZCFR,"BOZTI Back Cover for Samsung Galaxy A50, Samsung Galaxy A50s",4,Pretty good,It's very nice I like it,Tanishka Dixit,Gorakhpur,2 months ago,0,1
97,AICGF8KFFAPSZJES,Orient Electric 85 L Desert Air Cooler,5,Must buy!,Awesome productCooling is better than hindware.Just go through it.,vivek raj,Nalanda,10 months ago,11,1
544,ACCF5Q2FBDBUZPAU,"Logitech M221 / Silent Buttons, 1000 DPI Optical Tracking, Ambidextrous Wireless Optical Mouse",5,Just wow!,Very good product,Anil Kumar,Anantapur,9 months ago,1,0
435,ACCGFXRTYWXRWA4T,"CEDO Flip Cover for Samsung Galaxy F12, Samsung Galaxy M12, Samsung Galaxy A12",2,Expected a better product,"Plastic case is not fitting properly , outer texture material is good.. plastic ,near finger touch  sensor , is very thin and not fitting..",Tuhin Suvra Mitra,Naldanga,5 months ago,0,0
294,ACCEQH83EUNCY3CV,SHINESTAR. Back Cover for Apple iPhone 6s,5,Terrific purchase,Thanks,Pintu  Barnwal ,Khandra,"Feb, 2020",0,0
616,AICEQVHUD9VZC4EG,Orient Electric 20 L Room/Personal Air Cooler,5,Excellent,very good. product,Ajay Pampaniya,Sutrapada,"Mar, 2020",5,3
701,ACCDTR26KZZMSB57,HP x500 Wired Optical Mouse,4,Worth the money,Good product !!! Packing was also good. 👍👍,Kunwar Ranvir Singh,Lucknow,"Jan, 2018",2,1
347,AICFFVVJFQHHNCN8,CROMPTON 88 L Desert Air Cooler,5,Good product. Recommended,Good product. Recommended for usage.,Vaibhav Dubey,Hyderabad,"Mar, 2020",9,2
234,ACCFX6XRVG54GWXH,"Casewilla Back Cover for Apple iPhone 12, Plain, Cover",2,Expected a better product,Chinese product. Nowhere casewilla brand name mentioned on the cover and It will turn yellow in 20 days of use.,Asif Khan,Bengaluru,5 months ago,0,0
588,ACCF5Q2FBDBUZPAU,"Logitech M221 / Silent Buttons, 1000 DPI Optical Tracking, Ambidextrous Wireless Optical Mouse",5,Awesome,Its very comfort and convenience to use,Rathish J,Dharmapuri District,1 month ago,0,0
6,AICERF3ZMFAYK4ZC,Hindware 85 L Desert Air Cooler,2,Not as good as even a local desert air cooler,"CONS:  Consumes a lot of power (this is my initial feeling after using it for a week or so); the fan speed dial is awkwardly designed.  When you switch on the fan, you'll end up starting it with High speed, then Medium and last is the Low which makes you to turn the dial 6 times every time it is switched on / off.  First time using the honeycomb cooling pads, I am a bit skeptical about their longevity as they can be easily torn.  Water level indicator tells you once it is just less than half ...",Ravi Kiran V,Hyderabad,"Mar, 2019",296,216
190,ACCFDK469A9W96HJ,ZEBRONICS Zeb-K20 Wired USB Desktop Keyboard,5,Super!,Fabulous. Keep going zebronics😍,Pallavi Bhargawa,Bhawani Mandi,"Aug, 2020",4,0
112,ACCEZ3YWU75CERHH,ZEBRONICS ZEB-KM-2100 Wired USB Desktop Keyboard,5,Great product,Very nice keyboard. Very good to use with lots of features.,Jayesh Patil,Surat,5 months ago,1,0
857,ACCFAUEFZT5R72ZS,Prolite Majestic Basket Wired USB Multi-device Keyboard,4,Really Nice,Like it nice quality,Abdul  Suban,Bathinda,"Feb, 2021",1,0
183,AICFFGJZTHSDN3AZ,Symphony 27 L Room/Personal Air Cooler,5,Excellent,Good product... Quality is excellent.,Kishan Kumar,Navi Mumbai,"Jul, 2020",32,8
452,ACCFB5RHGC5NYGV9,SUNSHINE Back Cover for Apple iPhone 7,5,Terrific purchase,Excellent,Chinna Hussain Shaik,Vijayawada,"Dec, 2019",0,0
