,product_id,product_title,rating,summary,review,name,location,date,upvotes,downvotes
776,ACCFAHEZ9HEFPHMG,Glink GLM69 Wired Optical Mouse,3,Fair,Ok,Supriya Daw,Kolkata,1 month ago,0,0
66,ACCGFCHVGTWSHZYU,GadgetM Back Cover for Apple iPhone XR,5,Wonderful,Awesome cover☺️☺️,Vivek Kumar soni,Gumia,9 days ago,0,0
96,ACCGFCHVGTWSHZYU,GadgetM Back Cover for Apple iPhone XR,5,Perfect product!,Good product,Sai Chakravarthi,Jammikunta,8 months ago,0,0
802,ACCFAHEZ9HEFPHMG,Glink GLM69 Wired Optical Mouse,1,Absolute rubbish!,Very bad,Swetha manoj,Kannur,4 months ago,0,0
531,AICEQGBHB75HSWGG,CROMPTON 75 L Desert Air Cooler,5,Just wow!,The main function that is cooling is amazing in this product. capacity is great at 75 litres. Product delivery was really good and on time and also in great condition. I will recommend it ober Symphony coolers as it is more value for money. And its cooling is incomparable.,Abhishek Kumar Bharti,Patna,"May, 2018",1,1
237,ACCGFXRUUQEYMRKA,"CEDO Flip Cover for Samsung Galaxy F12, Samsung Galaxy M12, Samsung Galaxy A12",1,Not recommended at all,Poor Quality.,Ramana Kumar,Chennai,5 months ago,0,0
583,ACCERQGMQCQFXGHC,GoldKart Back Cover for Apple iPhone 6 GOLDCASE-701,4,Pretty good,good finish,Monojit  Chowdhury ,Howrah,"Aug, 2018",27,2
71,AICERF3ZMFAYK4ZC,Hindware 85 L Desert Air Cooler,5,Great product,Super air cooler 👌❤️i m very happy best quality  product fan low speed like fast hindware quality best,vishal patil patil,Bhiwandi,12 days ago,1,0
365,ACCFUYXSJTY5BF3G,Carnage Flip Cover for Samsung Galaxy M01 Core,5,Best in the market!,Good 👍product 👌,ARUNA  NEWTON ,Chennai,9 months ago,0,0
223,ACCGFXRUUQEYMRKA,"CEDO Flip Cover for Samsung Galaxy F12, Samsung Galaxy M12, Samsung Galaxy A12",4,Worth the money,Good,Rumpu Saikia,Sibsagar,3 months ago,0,0
529,AICEQGBHB75HSWGG,CROMPTON 75 L Desert Air Cooler,5,Brilliant,"I ama truly satisfied with the product. It cools the room very well, even if the temperature is more than 42 degree celcius. I live in a place where the temperature goes more than 40 degree in the mid summer. I stay on the top floor. But since I am using this cooler I am having no problem due to excessive temperature which I used to face before. You just have to place the cooler in the right place with the right and scientific procedure.",Ayan Banerjeee ,Deuli,11 months ago,1,3
524,AICEQGBHB75HSWGG,CROMPTON 75 L Desert Air Cooler,4,Very Good,cooler rec'd in good condition from flipkart within delivery time.Quality of cooler is so wise as per expectation.Air circulation and flow is too good with honeycomb Colling effect.Thanks to flipkart for providing valuable product.,Vishal Mate,Nagpur,"May, 2019",2,4
186,ACCFX6XRVG54GWXH,"Casewilla Back Cover for Apple iPhone 12, Plain, Cover",4,Delightful,It's ok..,Mighty Sil,Jalpaiguri,7 days ago,0,0
458,ACCF47WBYF6EK9GH,"SHINESTAR. Back Cover for Apple iPhone 6s Plus, Apple iPhone 6 Plus",1,Utterly Disappointed,"Looks very classy ,bt easily gets break..very fragileNot for regular use",Kajol Singh,Thane,"Nov, 2020",1,0
463,ACCGFXRTYWXRWA4T,"CEDO Flip Cover for Samsung Galaxy F12, Samsung Galaxy M12, Samsung Galaxy A12",5,Terrific,Ok,Satyam satyam,Lucknow,8 months ago,0,0
233,ACCFBZGVBKU3MNFY,HP 100 Wired USB Desktop Keyboard,5,Must buy!,Awesome😍Very Nice Keyboard I Always Use 'HP' Products Buttons Working Like Very Smoothly. On Time Delivery At Home By 'Ekart' Logistics Thank you So Much 'Flipkart',Praveen Kumar Satsangi,Bhojpur District,"Jan, 2021",7,1
1327,AICFNMDBXVAQMBVS,Symphony 80 L Desert Air Cooler,4,Really Nice,A very good cooler. Very nice airflow. But doesn't give air at low level if you are thinking of sleeping on floor.,Shubhankar Chaturvedi,New Delhi,9 months ago,0,0
632,ACCERQGMQCQFXGHC,GoldKart Back Cover for Apple iPhone 6 GOLDCASE-701,5,Fabulous!,Niz,PMR sekar,Chennai,"Mar, 2020",0,0
146,ACCEZ3YWU75CERHH,ZEBRONICS ZEB-KM-2100 Wired USB Desktop Keyboard,1,Horrible,waste,Navaneeth mamidi,East Godavari District,"Dec, 2018",0,0
529,ACCF5Q2FBDBUZPAU,"Logitech M221 / Silent Buttons, 1000 DPI Optical Tracking, Ambidextrous Wireless Optical Mouse",5,Brilliant,NICE PRODUCT FOR BETTER PRICE. FLIPKART DELIVERY IS ON DART!THANKS,PICHAI SHRIRAM,Chennai,11 months ago,3,1
560,ACCF47WBREUAVYHH,SHINESTAR. Back Cover for Apple iPhone 6s,5,Just wow!,Superb cover for my iPhone,Rahul Kumar,Jodhpur,7 months ago,0,0
471,ACCEHDYAKFAJ7EYQ,DELL KB 216 Wired USB Desktop Keyboard,5,Wonderful,although price is little high in comparison to others desktop keyboard but still smooth slim sleek design with clip supporter behind of it and keys are very smooth .,Vinay Behrani,Kanpur,"Oct, 2018",0,0
29,ACCFBPGHR8HWPHUF,HP 1000 Wired Optical Mouse,5,Terrific,Wow. Really looks better than shown in picture. Good quality. Nice design.Matt black + glossy back combination.  Fast 2 day delivery ( im from trivandrum) Im satisfied.,Arun,Thiruvananthapuram,"Mar, 2019",96,10
420,ACCGFXRTYWXRWA4T,"CEDO Flip Cover for Samsung Galaxy F12, Samsung Galaxy M12, Samsung Galaxy A12",5,Super!,Good,Nayum Warsi,Topa,3 months ago,0,0
1479,AICEQVHUGDDBYF6K,Orient Electric 50 L Window Air Cooler,1,Don't waste your money,"Waste of money, no cool air so much hell with the sound",Thirumalesh Annaveni,Palakurthy,10 months ago,0,0
1232,AICEQUFHVJGGHPMV,Symphony 35 L Tower Air Cooler,1,Waste of money!,"Don't even think of buying this productthe online description is completely misleading, the cooling area is not even 10 sqft , only the person who sits in front of the cooler can enjoy a bit . it hardly serves the purpose of a fan .",sourav purohit,Bhubaneswar,"Jun, 2019",2,1
428,AICFQV87NFUG595H,CROMPTON 40 L Room/Personal Air Cooler,5,Super!,Nice 👍,Praveen Kumar,Hyderabad,"Feb, 2021",4,0
1272,AICEQUFHVJGGHPMV,Symphony 35 L Tower Air Cooler,4,Value-for-money,Good.,Amol  Goud,Pimpri Chinchwad,2 days ago,0,0
945,ACCFBTYGYXRTU5GA,FU4 Portable Flexible Silicone Foldable Waterproof Wired USB Tablet Keyboard Wired USB Multi-device Keyboard (Black) Wired USB Multi-device Keyboard,4,Good choice,"It's good, worth for its price.",Jayaprakash R,Mangaluru,"Feb, 2019",6,9
488,ACCFZZ8GZPFHFGTM,Case Club Back Cover for Samsung Galaxy M12,5,Terrific,Good,Sudhir kumar Singh,Mahrajganj Mahrajganj District,7 months ago,0,0
365,AICFFVVJFQHHNCN8,CROMPTON 88 L Desert Air Cooler,1,Terrible product,Received before delivery date. That is good. Unboxed the cooler & filled with water. Cooling effect is not good. It feels like only fan is running. No effect of water. Disappointed with flipkart.,Dhaval Parmar,Andada,"May, 2020",3,3
49,RUKFS4HMZE75SVFT,Chaayos Chai-Time Snacks Premium flavored Sooji Rusk,5,Brilliant,Ideal for tea time.,SUSHANTA HOOM CHOUDHURY,Guwahati,"Jul, 2020",0,0
1579,AICFCMRDPJ4DK4ZD,Flipkart SmartBuy 30 L Tower Air Cooler,5,Just wow!,"Love the product. Easy to move, chilling effect is also good. Less noise. Sleak body hence can be kept easily to small places. Air throw is also good. Used for 6months and quite happy with the product. I would recommend it to others.",KUMAR UJJAWAL,Patna,7 months ago,0,2
101,AICGF8KFFAPSZJES,Orient Electric 85 L Desert Air Cooler,5,Worth every penny,Product is good overall but the delivery is too late i m not satisfied with gati courier service worst experience ever,Nirbhay Gautam,Firozabad,10 months ago,4,0
241,ACCFBZGVBKU3MNFY,HP 100 Wired USB Desktop Keyboard,5,Perfect product!,Best keyboard,Harinder Kumar,Kurukshetra District,"Aug, 2019",2,0
314,ACCGY4GMUVP9UFNS,"HUPSHY Back Cover for Samsung Galaxy M12, Samsung Galaxy F12, Samsung Galaxy A12",5,Highly recommended,Super flippant awesome 👌,Amit  Chaubey ,Jhansi,9 months ago,0,0
696,AICEQUFHBKNF5U4T,Symphony 12 L Room/Personal Air Cooler,2,Quality vs look wise Compare vs Diet12i vs Diet12t,Not as much as thought. I think Diet 12i is the better than Diet 12t.bcz it's provide remote ....Ok but not bad.it s for only personal or single small room.,Abhishek Singh,Anwari,"Apr, 2018",2,0
482,ACCFXUAB8YXRXTDF,"SHINESTAR. Back Cover for Apple iPhone 7 Plus, Apple iPhone 8 Plus",4,Wonderful,Valuable for money,Farhan Mp,Kozhikode,1 month ago,0,0
680,AICEQUFHBKNF5U4T,Symphony 12 L Room/Personal Air Cooler,4,Wonderful,Air cooler Size is too short and only half portion air throw .,AMRIT SINGH,Jamshedpur,"Sep, 2018",20,8
727,ACCDTR26KZZMSB57,HP x500 Wired Optical Mouse,5,Highly recommended,Batter parforme,ShivShankar Kumar,Supaul District,4 months ago,0,0
340,AICFFVVJFQHHNCN8,CROMPTON 88 L Desert Air Cooler,5,Terrific,Good product. Given same model which one I choose. Delivered safely. I love flipkart services  that I owe till now. Thanks flipkart team for wonderful job you are doing.,Ajay  Abraham ,Raipur,"Jan, 2021",3,2
164,AICFFGJZTHSDN3AZ,Symphony 27 L Room/Personal Air Cooler,5,Worth every penny,"Soft sound while, running in high speed.. cooling effect start within 30 minutes after switch on.. very nice product by symphony.. most important value for the money",Sudip Malik,Hyderabad,"Jun, 2020",6,1
780,ACCFAHEZ9HEFPHMG,Glink GLM69 Wired Optical Mouse,4,Very Good,Very good product,Nirmal Saha,Phulia,2 months ago,0,0
31,AICERF3ZMFAYK4ZC,Hindware 85 L Desert Air Cooler,5,Must buy!,Nice colooer.I have purchased it last week.Fan Speed is very good and throw cold air. Fan speed determine the cooling of an cooler. So its fan speed is fantastic.Overall I am fully satisfied with it.Water tank is good capacity. 85 litre.Only Cons. Is Wheel should have lock mechanism so that colooer will not move when it was on and specially it is for smoothly surface like on tiles.Rest is perfect. go for it.,Rashid Mohd,Gautam Buddha Nagar District,11 months ago,6,1
1080,AICFYNGFPPNRM8FG,Symphony 27 L Room/Personal Air Cooler,4,Value-for-money,Pretty good.... Air cooled down very well....but fan noise ...... If you neglect ....best product,Rajendra jadhav Jadhav,Lote Parshuram Midc,26 days ago,0,0
518,ACCEHDYAKFAJ7EYQ,DELL KB 216 Wired USB Desktop Keyboard,5,Terrific,Nice one,swapnil sabe,Akola,1 month ago,1,0
353,AICFFVVJFQHHNCN8,CROMPTON 88 L Desert Air Cooler,5,Great product,Awesome,Anil  Kumar ,Anantapur,"May, 2020",9,3
303,ACCGFWY2ARNJDAJG,GadgetM Back Cover for Apple Iphone 12,5,Mind-blowing purchase,"Awesome, fits perfectly. Packaging is good and delivery boy is humble. Closing is available on charging port. Over all expectations is good..",Ramesh Kumar S,Chennai,2 months ago,3,2
128,ACCEZ3YWU75CERHH,ZEBRONICS ZEB-KM-2100 Wired USB Desktop Keyboard,5,Perfect product!,according to price it's good compare to others.it does its job,Abhinav  Kumar,New Delhi,"Jul, 2019",1,0
832,ACCFAUEFZT5R72ZS,Prolite Majestic Basket Wired USB Multi-device Keyboard,5,Best in the market!,Good,Badal kumar Bairwa ,Aligarh,11 months ago,0,0
275,ACCEQH83EUNCY3CV,SHINESTAR. Back Cover for Apple iPhone 6s,5,Best in the market!,Super,Hussain Ghani,Ramanathapuram District,"Feb, 2021",0,0
379,ACCFH7H8FG6GZMKB,"Flipkart SmartBuy Back Cover for Samsung Galaxy A20, Samsung Galaxy A30, Samsung Galaxy M10S",5,Great product,Good Product,MAROJU.BHASKARA CHARY.,Secunderabad,4 months ago,0,0
277,ACCFBZGVBKU3MNFY,HP 100 Wired USB Desktop Keyboard,5,Awesome,Best in the market,Ambuj maurya,Prayagraj,15 days ago,0,0
105,CKBFS8YEP4YSAA9G,Chaayos Chai-Time Snacks Cookies,5,Best in the market!,These cookies really taste delicious . These cookies are loaded with choco chips .we have this with our evening tea.Packaging was also good,Purnima,Bokaro Steel City,3 months ago,0,0
665,AICEQUFHBKNF5U4T,Symphony 12 L Room/Personal Air Cooler,5,Simply awesome,Really good price Symphony very silent good capacity for small bedroom I like value for money I bought 5200 from Flipkart I am outside check price 6500 6201 I am buying from Flipkart 5200 very value for money,Altaf Hanif Patanwala Hanif,Thane,"May, 2017",1,5
61,AICERF3ZMFAYK4ZC,Hindware 85 L Desert Air Cooler,3,Does the job,"Not very effective in the heat of may and june, in fact the wind does not even feel cool in this heat. Water consumption is definitely less but it doesn't make any sense if this less consumption of water doesn't even cool the wind. Overall, a good product for only Low to Medium temperature places",Trapti Gupta,Aligarh,"Jun, 2019",3,2
97,ACCGYWFK2JE2BJR8,"GoldKart Back Cover for Samsung Galaxy M12, Samsung Galaxy A12, Samsung Galaxy F12",4,Very Good,Good,DURGA RAO  PITHANI,West Godavari District,4 months ago,0,0
171,ACCFDK469A9W96HJ,ZEBRONICS Zeb-K20 Wired USB Desktop Keyboard,5,Excellent,Very good product,Gajendra Padhan,Bargarh District,5 months ago,42,2
127,ACCFYV8ZGVEM4DVE,GadgetM Back Cover for Apple Iphone 11,5,Simply awesome,Nice quality good,Vikram  Kolekar ,Pandharpur,17 days ago,0,0
1409,AICESQCZZVR3CMBM,Symphony 55 L Room/Personal Air Cooler,1,Terrible product,body is not good,Vijay Singh,Gaziabad,9 months ago,0,0
264,ACCGFXRUUQEYMRKA,"CEDO Flip Cover for Samsung Galaxy F12, Samsung Galaxy M12, Samsung Galaxy A12",5,Classy product,Nice products,SHELENDRA  SHARMA,Khargone,9 months ago,0,0
162,ACCFRWVBWVBHHCXG,"KWINE CASE Back Cover for Samsung Galaxy F41, Samsung Galaxy M31, Samsung Galaxy M21 2021",5,Must buy!,Nice,Naveen Goswami,Siwan District,1 month ago,0,0
598,AICEQVHUD9VZC4EG,Orient Electric 20 L Room/Personal Air Cooler,5,Highly recommended,great cooler nice cooling beyond expectations,Akshay Anand,Saram,"May, 2019",4,1
88,ACCEZ3YWU75CERHH,ZEBRONICS ZEB-KM-2100 Wired USB Desktop Keyboard,4,Good quality product,"good product, you can order it without any hesitation it was great but so sensitive.",Mohit Kumar,Bettiah,"Jan, 2019",0,1
845,ACCFAUEFZT5R72ZS,Prolite Majestic Basket Wired USB Multi-device Keyboard,5,Just wow!,Nice,Dhruv Kushwaha,Nowgong,"Mar, 2021",0,0
253,ACCFBZGVBKU3MNFY,HP 100 Wired USB Desktop Keyboard,5,Awesome,"Excellent Product, packing and delivery was very good.",Manikandan Ganesan,Ernakulam District,"Aug, 2020",1,0
527,ACCF47WBREUAVYHH,SHINESTAR. Back Cover for Apple iPhone 6s,5,Terrific,Very nice sexy cover,Sandeep Prajapati ,Rampur District,9 days ago,0,0
45,ACCFBPGHR8HWPHUF,HP 1000 Wired Optical Mouse,1,Horrible,Very USELESS product. Its wheel did not move after 2 months.,TUSARAKANTA KALO,Debagarh District,"Jul, 2019",1,0
518,ACCF47WBREUAVYHH,SHINESTAR. Back Cover for Apple iPhone 6s,5,Just wow!,Osm fiT.love to buy.fast delivery.suprb quality,ROCKY ydv,Saharsa,8 months ago,1,0
18,AICERF3ZMFAYK4ZC,Hindware 85 L Desert Air Cooler,2,Expected a better product,"Pros:1. 85 litre capacity - If you run 10 hours a day, it will go up to 4 days minimum.Cons:1. Cooling effect decreased with in a month of usage.2. No filteration.3. Loud noise. Not sure if everyone experience the same but I myself used to keep it off and run the ceiling fan instead even if it's hot just because of it's loud noise. It happened after 1 month of usage. First month was fine.4. Not good for home if you have childrens < 5 years of age. Because kids could easily reach fan a...",Ali Askar A,Bengaluru,"Apr, 2019",36,12
759,AICFERMY7WWWAZYZ,Hindware Calisto 50 L Desert Air Cooler,5,Great product,Perfect air cooler in desert category. High cooling in our room. Must buy this product.Special thanks to hindware for this Cooler.,Rakesh Rakhee,Kurnool,"Sep, 2020",4,1
449,ACCEHDYAKFAJ7EYQ,DELL KB 216 Wired USB Desktop Keyboard,5,Super!,"Wonderful keyboard, nothing beats typing on a wired keyboard. Fir coding its a breeze. packaging well done, delivered 2 days before scheduled date. paired with a dell mouse its wonderful",Tapadyuti Chatterjee,Bengaluru,"Jun, 2020",32,18
1029,AICGC6YYNZJHZTCA,CROMPTON 75 L Desert Air Cooler,1,Worthless,I did not like this product. Its fan doesn't work properly. The engineer comes and gives false hopes to my parents and returns back anf you guys have cancelled my refund. This is ridiculous. This is a waste product.Jeeves and Flipkart have duped us big time.,Vivek,Bhubaneswar,"Jun, 2018",7,0
1069,AICFYNGFPPNRM8FG,Symphony 27 L Room/Personal Air Cooler,5,Brilliant,Performance really very Good. As expected....,Ashok Kumar,Berhampur,2 days ago,0,0
920,ACCES6YFGJFF7GFJ,QUANTUM QHM7307 MINI MULTIMEDIA KEYBOARD Wired USB Multi-device Keyboard,1,Unsatisfactory,Worst product.,Vishal Naik,Uttara Kannada District,3 months ago,0,0
352,ACCGFWY2ARNJDAJG,GadgetM Back Cover for Apple Iphone 12,5,Best in the market!,Nice and handy,Dnyaneshwar Bawane,Nagpur District,2 months ago,0,0
0,ACCGFWY43WADZC5E,GadgetM Back Cover for Apple Iphone 12,1,Waste of money!,low quilty,Gajnafar Ali,Ghaziabad,5 months ago,0,0
1473,AICEQVHUGDDBYF6K,Orient Electric 50 L Window Air Cooler,5,Must buy!,Cooler is superb on this rate...,VIJAYKUMAR DEVANI,Surat,"May, 2018",2,0
1145,AICFNNBW9EB2S9ZA,Symphony 55 L Tower Air Cooler,4,Good quality product,Product was good and working properly.Cooling is also good for 1 room and taking smaller space.Nice Product and Value for money.,Rohil Kumar,New Delhi,"Apr, 2021",7,3
548,ACCF47WBREUAVYHH,SHINESTAR. Back Cover for Apple iPhone 6s,5,Mind-blowing purchase,It enhanced the look of my iPhone. Good quality.Satisfied.,Vinod Kumar Singh,Rampur,4 months ago,0,0
467,AICFQV87NFUG595H,CROMPTON 40 L Room/Personal Air Cooler,1,Horrible,"It's like blower of car, no cooling",Tanmoy Bhaduri,New Town,10 months ago,1,0
609,ACCF5Q2FBDBUZPAU,"Logitech M221 / Silent Buttons, 1000 DPI Optical Tracking, Ambidextrous Wireless Optical Mouse",5,Fabulous!,Really valuable,Thiyagarajan M,Salem District,2 months ago,0,0
99,CKBFS8YMZSZCGXXZ,Chaayos Chai Time Snack Dry Fruit Cookies Cookies,5,Just wow!,Awesome Taste...must have product...Thanks to Chaayos for creating such a good product...,Nitesh Gudhka,Mumbai,"Aug, 2020",0,0
915,AICERF3ZUEZPUWFK,Hindware 36 L Room/Personal Air Cooler,5,Perfect product!,Super Product for this price range.,Sailash  V,Puthunagaram,"Mar, 2019",14,4
231,ACCFBZGVBKU3MNFY,HP 100 Wired USB Desktop Keyboard,5,Terrific purchase,very good,Avijit Das,Hugli District,"Jul, 2019",1,0
1464,AICEQVHUGDDBYF6K,Orient Electric 50 L Window Air Cooler,5,Excellent,Nice product,M Ravi Kumar,Mancherial District,"Mar, 2021",3,1
163,CKBET6WU5APC49HS,BRITANNIA NutriChoice Digestive High Fibre Biscuits Digestive,3,Just okay,Ok,javed usmani,Baruni,3 months ago,0,0
712,ACCDTR26KZZMSB57,HP x500 Wired Optical Mouse,5,Excellent,Good,Santosh Kumar  Biswal,Pune,28 days ago,0,0
175,CKBET6WU5APC49HS,BRITANNIA NutriChoice Digestive High Fibre Biscuits Digestive,4,Nice product,Appears nice productThanks,Seema Rastogi,Lucknow,3 months ago,0,0
40,AICERF3ZMFAYK4ZC,Hindware 85 L Desert Air Cooler,5,Must buy!,"Got it for Rs6770. 5 wheels and nice packing....cooling good 800 sqft hall...movable wheels help me to keep in living room in the day and shift to bedroom in night...solving dual purpose...good buy.One important note, these days in delhi temp is more than 45 degree, trust me this cooler isnt helpfull. infact even other cooler wont be helpfull. so if ur looking for something in this weather, better go for airconditioner",rahul mahajan,New Delhi,"Apr, 2019",5,2
76,CKBFS9JGAC9CTX43,Chaayos Chai Time Snack Premium Coconut Cookies Cookies,5,Terrific,"Its an excellent cookie, taste is awesome. Lovely to have them with tea. Great product and flavor is very nice. This is from Indian manufacturers. Go Vocal for local.",Gaurav .,Chapra,"Aug, 2020",0,0
784,AICFERMY7WWWAZYZ,Hindware Calisto 50 L Desert Air Cooler,1,Not recommended at all,pump motor got damaged within 3 months of use only.,Ashutosh Kumar,New Delhi,"Oct, 2020",1,0
176,AICFFGJZTHSDN3AZ,Symphony 27 L Room/Personal Air Cooler,1,Not recommended at all,A very poor product. There are no seperate filters in this cooler but a coating on honeycomb pad that can not act as a filter as there are voids in the pads.There is no seperate dust filter.The pads can not be removed easily for cleaning of the tank. The fan makes noise. It does not have an ice chamber. The louvers do not close completely.,Amandeep Singh,Ludhiana,"Jul, 2019",142,38
1015,AICGC6YYNZJHZTCA,CROMPTON 75 L Desert Air Cooler,5,Just wow!,The main function that is cooling is amazing in this product. capacity is great at 75 litres. Product delivery was really good and on time and also in great condition. I will recommend it ober Symphony coolers as it is more value for money. And its cooling is incomparable.,Abhishek Kumar Bharti,Patna,"May, 2018",1,1
4,ACCFZUG7KF9ATX9H,"Casotec Back Cover for Samsung Galaxy M12, Samsung Galaxy A12, Samsung Galaxy F12 Clear TPU Case",5,Excellent,Perfect fit value for money go for it,Karthik S,Bangalore,8 months ago,1,0
736,AICFERMY7WWWAZYZ,Hindware Calisto 50 L Desert Air Cooler,4,Nice product,nice product in chepest rate cooling very very good I recommended,Binay kumar srivastava,New Delhi,"Jun, 2019",12,3
404,ACCGFXRTYWXRWA4T,"CEDO Flip Cover for Samsung Galaxy F12, Samsung Galaxy M12, Samsung Galaxy A12",5,Just wow!,Nice,saikat mandal,Jalpaiguri District,1 month ago,0,0
896,AICERF3ZUEZPUWFK,Hindware 36 L Room/Personal Air Cooler,5,Just wow!,Good one ...air throw is super... for chilled air kindly fill the ice chamber with ice..build quality is good .. decent design,Hemant Kejriwal,Hyderabad,"May, 2019",2,0
1419,AICESQCZZVR3CMBM,Symphony 55 L Room/Personal Air Cooler,1,Unsatisfactory,Its a waste product,sameer bansal,Hoshiarpur,"Jul, 2020",0,0
344,ACCGFWY2ARNJDAJG,GadgetM Back Cover for Apple Iphone 12,5,Best in the market!,Nice product,KIRAN KUMAR LINGA,Bengaluru,2 months ago,0,0
1099,AICFYNGFPPNRM8FG,Symphony 27 L Room/Personal Air Cooler,5,Awesome,Perfect for a mid size office cabin.... can't expect more than this at such price.....m happy with it.And ya there is no water spillage issue as mentioned in some previous reviews..,Avinash  Berlia ,Bengaluru,9 months ago,0,0
399,ACCFG3ACAXXHHRHW,"SRT Back Cover for Apple iPhone 7, Apple iPhone 8",5,Must buy!,Awesome quilty,Debajyoti Goswami,Baleshwar District,"Sep, 2020",0,0
234,ACCFBZGVBKU3MNFY,HP 100 Wired USB Desktop Keyboard,4,Very Good,"Keyboard is very soft key stroke 👍Best for typing practice and Home, Office Work Thanks hp🙏",Vishal Korke,Nanded Waghala,10 months ago,3,0
152,AICGF8KFFAPSZJES,Orient Electric 85 L Desert Air Cooler,4,Value-for-money,"Product is good under 8k only  ,i got it for 7961 including supercoins, today received products .. and 5 to 6 hours used today... Cooling is average..not that great..,i had used local market coolers.. and some local coolers cooling fantastic ... And some giving average cool.. i can say ,this orient cooler giving average cooling ..not much great. U can get cool air infront of cooler... But not cooling room ,i used 5 to 6 hours.today...noise is less on side , slightly noise, but we can ignore ...",Om kumar Singh,Begusarai District,1 day ago,0,0
67,ACCGFCHVGTWSHZYU,GadgetM Back Cover for Apple iPhone XR,5,Best in the market!,This is the best cover I ever bought for XR…,Arunmurugesh B,Maraimalai Nagar,1 month ago,0,0
811,AICFYNG9D7JTYFZE,Symphony 70 L Desert Air Cooler,5,Just wow!,Good quality,Akash Mishra,Agra,10 months ago,4,1
973,AICGC6YYNZJHZTCA,CROMPTON 75 L Desert Air Cooler,5,Awesome,Great cooler go for it 👍. Overall great product at good price . Great looks fantastic air throw. Faster cooling best for medium size bedrooms.Pros:Compact sizeElegant lookAwesome coolingCons: For some people a bit noise of water pump,Shakti Mishra,Lucknow,"Mar, 2021",14,0
189,ACCFX6XRVG54GWXH,"Casewilla Back Cover for Apple iPhone 12, Plain, Cover",3,Good,Its ok,Ramana Bellamkonda,Prakasam District,13 days ago,0,0
54,AICERF3ZMFAYK4ZC,Hindware 85 L Desert Air Cooler,5,Fabulous!,arrived in good shape and working fine excellent air flow I'm using in low soo happy with hindware and a excellent deal with flip kart thankfully it working fine,DrAbhishek Saxena,Bhopal,"May, 2019",1,0
457,ACCFB5RHGC5NYGV9,SUNSHINE Back Cover for Apple iPhone 7,4,Value-for-money,Best cover looks good,RAJEEV SHARMA,New Delhi,"Dec, 2018",0,0
636,ACCEGVTXGKZDXFRX,AMKETTE Xcite Neo Mouse & Wired USB Laptop Keyboard,4,Really Nice,Good,Jaikrishnan V,Kottayam District,"Aug, 2018",68,6
1355,AICESQCZZVR3CMBM,Symphony 55 L Room/Personal Air Cooler,1,Worthless,main problem is humidity it creates in the room,Pushpendra Naagar,Jodhpur,"Sep, 2018",15,2
1123,AICFNNBW9EB2S9ZA,Symphony 55 L Tower Air Cooler,4,Good quality product,Low power Tower Cooler. Amazing product. Small and portable size. Low Noise. The touch controls of the cooler makes it more premium. However the quality of plastic is average. Easy to get scratches. Overall functional cooler for small size room.,Akash Bhatt,Roorkee,10 months ago,12,6
73,ACCGFCHVGTWSHZYU,GadgetM Back Cover for Apple iPhone XR,5,Just wow!,Very good quality…,Dipak Chaudhari,Pimpri Chinchwad,4 months ago,0,0
529,ACCF47WBREUAVYHH,SHINESTAR. Back Cover for Apple iPhone 6s,4,Very Good,Good look,Deepak Behera,North Goa,19 days ago,0,0
245,ACCGFXRUUQEYMRKA,"CEDO Flip Cover for Samsung Galaxy F12, Samsung Galaxy M12, Samsung Galaxy A12",5,Highly recommended,Aswam,Hriday Seal,Kalyani,7 months ago,0,0
281,AICGYH26HGMFGEBF,Hindware Snowcrest 45 L Room/Personal Air Cooler,5,Wonderful,Best at its price range. Go for it. Will update it after a month use.,Nilutpal Karmakar,Guwahati,20 days ago,2,0
556,AICEQVHUD9VZC4EG,Orient Electric 20 L Room/Personal Air Cooler,4,Really Nice,Cooler one of the BestHoney Comb Filter GoodPlastic Mesh OKDrain Plug Available but not sure about its rubbber plug qualityOverFlow ooutlet not providedManually we have to keep watch on if Wanter Tank is getting EmptyAir Throw One of the BestAir Circulation GoodMay not feel the Cooling like Desert Coolers Still does its JOB pretty wellThanks Birla Group for a wonderful Product,Flipkart Customer Ajit,Navi Mumbai,10 months ago,6,0
751,ACCFAHEZ9HEFPHMG,Glink GLM69 Wired Optical Mouse,5,Highly recommended,Awesome Product 👍,Fahad Ansari,Allahabad,4 months ago,1,0
381,ACCFH7H8FG6GZMKB,"Flipkart SmartBuy Back Cover for Samsung Galaxy A20, Samsung Galaxy A30, Samsung Galaxy M10S",5,Great product,Good Product,Tushar Naik,Sambalpur District,4 months ago,0,0
