,product_id,product_title,rating,summary,review,name,location,date,upvotes,downvotes
14,AICERF3ZMFAYK4ZC,Hindware 85 L Desert Air Cooler,3,Does the job,Decent cooler. Nice cooling. Less of moisture as compare to other coolers. Just swing was not working when received so just got it repaired with Hindware as it is on warranty. Rest everything is fine you can go for it.,Vaishali Singh,Chapra,"May, 2019",24,2
1428,AICESQCZZVR3CMBM,Symphony 55 L Room/Personal Air Cooler,5,Terrific purchase,Very nice,Amit  Sisodiya,Jodhpur,"Apr, 2018",3,2
1296,AICFNMDBXVAQMBVS,Symphony 80 L Desert Air Cooler,5,Must buy!,The cooler is excellent.,Setapandu Debbarman,Kolkata,"Aug, 2020",0,0
552,ACCF5Q2FBDBUZPAU,"Logitech M221 / Silent Buttons, 1000 DPI Optical Tracking, Ambidextrous Wireless Optical Mouse",5,Perfect product!,Dope product.,Praveen  Mani,New Delhi,"Mar, 2021",0,0
1028,AICGC6YYNZJHZTCA,CROMPTON 75 L Desert Air Cooler,4,Pretty good,Speed and cooling are awesome. But noisy. Gives you AC feeling. Wish I could get it in low noise. It’s a huge one.,Avinash Pawar,Pune,"Mar, 2019",25,4
331,ACCFVFZGBTVJZYJG,Case Club Back Cover for Samsung Galaxy M01 Core,5,Just wow!,best products,Deepak  Pande,Bhubaneswar,5 months ago,2,0
94,ACCGYWFK2JE2BJR8,"GoldKart Back Cover for Samsung Galaxy M12, Samsung Galaxy A12, Samsung Galaxy F12",1,Not recommended at all,Low quality,Pawan Kumar,Yamunanagar,4 months ago,0,0
199,AICFFGJZTHSDN3AZ,Symphony 27 L Room/Personal Air Cooler,1,Not recommended at all,Not happy with the product as it is not effective and cooling is not up to the mark,Prabhuraj N,Ballari,"Apr, 2021",6,2
256,ACCEQH83EUNCY3CV,SHINESTAR. Back Cover for Apple iPhone 6s,4,Good quality product,Very good,Niranjan Behera,Tangi,3 months ago,0,0
1165,AICFNNBW9EB2S9ZA,Symphony 55 L Tower Air Cooler,1,Absolute rubbish!,quality of the product is bad,velagala priyanka,Vijayawada,"Nov, 2020",1,0
795,ACCFAHEZ9HEFPHMG,Glink GLM69 Wired Optical Mouse,1,Waste of money!,Not working,Muhammed irfan.k Irfan,Wayanad District,3 months ago,0,0
1133,AICFNNBW9EB2S9ZA,Symphony 55 L Tower Air Cooler,4,Delightful,Small room cooler ok...... Not a big space n hall use 2-3 people this good,mukesh kumar,Patna,"May, 2020",18,5
515,ACCEHDYAKFAJ7EYQ,DELL KB 216 Wired USB Desktop Keyboard,5,Excellent,Great product.. Thanks to flipkart,Mrutyunjaya panda,Bhubaneswar,"Dec, 2019",4,2
322,ACCG69QFS8M7WF8V,NKCASE Back Cover for Samsung Galaxy M32 5G,5,Terrific purchase,"One of the best quality case, snugly fit worth price. Go for it",samiwajid84,Kalaburgi,1 month ago,0,0
286,ACCEQH83EUNCY3CV,SHINESTAR. Back Cover for Apple iPhone 6s,5,Terrific,super,Rocky Ganga,Thiruvallur,"Aug, 2020",0,0
451,AICFQV87NFUG595H,CROMPTON 40 L Room/Personal Air Cooler,5,Simply awesome,It's Good product paisa vasul,Balaji Khandare,Karjat Ahmadnagar District,9 months ago,0,0
1152,AICFNNBW9EB2S9ZA,Symphony 55 L Tower Air Cooler,5,Brilliant,Very nice product....Original Product...I m Satisfy with this...Product.....Worth Buying....Easy To Fit..,Bishal Paul,Mariani,9 months ago,1,0
699,ACCDTR26KZZMSB57,HP x500 Wired Optical Mouse,5,Must buy!,Good product... 👍,Mamata Nivajekar,Sindhudurg District,"Aug, 2018",5,1
252,AICGYH26HGMFGEBF,Hindware Snowcrest 45 L Room/Personal Air Cooler,5,Wonderful,Hindware cooler very nice cooling 👌👍 ...performance very nice 👌very good product to Flipkart.....l am very happy 😊 thanks to Flipkart......,Mayur  Thakare,Bhiwandi,10 months ago,1,1
88,CKBFS8YMZSZCGXXZ,Chaayos Chai Time Snack Dry Fruit Cookies Cookies,5,Super!,Worth every penny!,Momo  Singh ,New Delhi,1 month ago,0,0
810,ACCFAUEFZT5R72ZS,Prolite Majestic Basket Wired USB Multi-device Keyboard,4,Wonderful,Best Products !! 💯,Omkar Balekar,Thane,9 months ago,5,0
769,AICFERMY7WWWAZYZ,Hindware Calisto 50 L Desert Air Cooler,3,Fair,It's one of the best cooler you can find in the market. Buy it without a second thought. You will not regret it.At first it was good but the pump just stopped working suddenly it's not been even 2 complete months,Rahul Kaithal,Kasganj,11 months ago,2,0
825,ACCFAUEFZT5R72ZS,Prolite Majestic Basket Wired USB Multi-device Keyboard,5,Wonderful,It is wonderful please buy it.,Debasish Ghosh,Sarpi,2 months ago,1,0
994,AICGC6YYNZJHZTCA,CROMPTON 75 L Desert Air Cooler,5,Great product,"Awesome cooler. Very good product. The product is very carefully packed. Thanks to seller. Reached very early than the promised date. Cooler is best in class with enough air flow and cooling. For initial 2,3 days you may feel bad smell because of honey comb, just add some dettol liquid in water it helps.",Sopparapu Hemanth,Sri Potti Sriramulu Nellore District,"Jun, 2019",11,11
823,ACCFAUEFZT5R72ZS,Prolite Majestic Basket Wired USB Multi-device Keyboard,5,Awesome,nice product,Hitesh Yadav,Rewari District,"Jan, 2021",1,1
41,ACCFBPGHR8HWPHUF,HP 1000 Wired Optical Mouse,4,Good choice,Good product.works smoothly....fast delivery.,Anindya Das,Kolkata,"Mar, 2019",5,1
720,AICFERMY7WWWAZYZ,Hindware Calisto 50 L Desert Air Cooler,5,Super!,The best affordable cooler for people with budget. You can get it for 7100 rupees and have better results than the other companies.,anand.k.nair,Kottayam District,"Mar, 2021",4,2
329,AICFFVVJFQHHNCN8,CROMPTON 88 L Desert Air Cooler,5,Just wow!,"Flipkart delivered Crompton Desert Air Cooler 88 Litres well before the schedule date. Before buying I compared with Bajaj Desert Coolers, here Crompton seems to be much better based on the Fan speed and Quality. Water tank capacity of 88 Litres is much needed. Crompton gives Honey Comb Cooling pads for better cooling compared to Wood Wool. It cools the room efficiently which makes us much comfortable in summer of Chennai City.",Anand Kumar R,Chennai,"Jun, 2019",46,12
1341,AICFNMDBXVAQMBVS,Symphony 80 L Desert Air Cooler,3,Good,Air flow is not good nd cooling is just ok. High noise nd Spitz water out,Rishi Sahu,Bhopal,11 months ago,0,0
481,ACCFXUAB8YXRXTDF,"SHINESTAR. Back Cover for Apple iPhone 7 Plus, Apple iPhone 8 Plus",3,Nice,BEST FOR 7plus. Not good for 8plus,PANKAJ  ANIL KOKATE,Pune District,1 month ago,0,0
23,CKBFS9J6XWHSSQRJ,Chaayos Chai Time Snack Chocochip Cookies Cookies,5,Great product,"This cookies is better than others. If i compare in taste, sweetness is balanced. and now it's my first choice in cookies.",Prince  Garg,New Delhi,"Nov, 2020",0,0
362,ACCE94WY6QPXKXFN,HP C2500 Wired Combo keyboard and Mouse,5,Worth every penny,I love HP keyboards...keys r so sumth and looks very nice...,govind  mishra,New Delhi,"May, 2017",4,1
499,ACCEHDYAKFAJ7EYQ,DELL KB 216 Wired USB Desktop Keyboard,5,Highly recommended,cool,PRAVEEN KUMAR,Jaipur District,"Oct, 2018",6,2
383,ACCE94WY6QPXKXFN,HP C2500 Wired Combo keyboard and Mouse,5,Fabulous!,best product for bloggers and love you so much,Koladara vijay Dineshbhai,Botad,"Jan, 2019",1,0
172,ACCFYV8ZGVEM4DVE,GadgetM Back Cover for Apple Iphone 11,5,Fabulous!,Best cesh,Aditya Singh,Varanasi,2 months ago,0,0
45,RUKFS4HMZE75SVFT,Chaayos Chai-Time Snacks Premium flavored Sooji Rusk,5,Fabulous!,I was always searching for good rusk which doesn't go soggy over sometime and I think I found the best brand for that. The packaging was great which didn't break the rusk and maintained the properties. I now enjoy my morning and evening chai with rusk! Thank you Chaayos  :),Meenakshi Saranga,Gurugram,"Oct, 2020",0,0
930,AICERF3ZUEZPUWFK,Hindware 36 L Room/Personal Air Cooler,4,Pretty good,Nice product..... Good..... 3.8/5,Aswin Aravind,Elampalloor,"Sep, 2020",2,0
147,ACCEZ3YWU75CERHH,ZEBRONICS ZEB-KM-2100 Wired USB Desktop Keyboard,1,Worst experience ever!,cheap plastic but ok for this price,Harish Rudra,Hyderabad,"Dec, 2018",0,0
62,ACCFBPGHR8HWPHUF,HP 1000 Wired Optical Mouse,1,Very poor,Very bad my mouse wheel /scroll button doesn't working since return policy ends nd hp support cant  reply our complain and no one can answering properly so guys do not buy tjis product,Dhaval Chauhan,Ahmedabad,"Aug, 2020",0,0
706,AICEQUFHBKNF5U4T,Symphony 12 L Room/Personal Air Cooler,5,Super!,8 days on good work no eny problems Symphony air cooler enium etha problem illama work aakanum god,Riyaz A,Tirunelveli,"Apr, 2018",5,3
1414,AICESQCZZVR3CMBM,Symphony 55 L Room/Personal Air Cooler,1,Worthless,Everything is good but when it is in swing mode it produce a noise like tik tik which make disturb during sleeping 😴,Jeetu sahu,Bargarh District,11 months ago,0,0
38,AICERF3ZMFAYK4ZC,Hindware 85 L Desert Air Cooler,5,Classy product,this is just amazing once in this price..all configuration working very nice.. cooling superbb..swing also nice..value of money..i love this product as much my expectations..this is looking very nice classical..i am very happy with it.. delivery boy behavior very gud..this product delivered on before time..thanks flip cart. love you💐💐,Golden al prince,Supaul,"Jun, 2019",4,1
691,AICEQUFHBKNF5U4T,Symphony 12 L Room/Personal Air Cooler,5,Classy product,Good productNice,Arjun Aju,Alappuzha District,"Apr, 2018",11,4
657,ACCG9BV88N3KXKJH,KartV Back Cover for Apple Iphone 11,1,Absolute rubbish!,Paint started peeling off in 2 days only.,Lokesh Bohra,Pithoragarh,2 months ago,0,0
1067,AICFYNGFPPNRM8FG,Symphony 27 L Room/Personal Air Cooler,1,Unsatisfactory,Not  good,Brijesh Singh,West Delhi,1 day ago,0,0
1023,AICGC6YYNZJHZTCA,CROMPTON 75 L Desert Air Cooler,5,Terrific purchase,EXCELLENT.  I recommend it. But you need  fill Drinking water 25Ltrs for 10 Hours approximately and using Soft water (Drinking) is best to retain the water pump life. Little bit Noisy in Fast Mode. useful for 20 X 11 sqft area.,BalaSundaram G.V.,Coimbatore,"Apr, 2019",0,3
254,ACCEQH83EUNCY3CV,SHINESTAR. Back Cover for Apple iPhone 6s,5,Terrific,Good ☺️☺️ back caver,Ashish Bhanarkar,Nagpur,2 months ago,0,0
49,ACCGFWY43WADZC5E,GadgetM Back Cover for Apple Iphone 12,5,Classy product,Stiill using and worth the price,Munish Thakurr,Kangra District,2 months ago,0,0
336,ACCFVFZGBTVJZYJG,Case Club Back Cover for Samsung Galaxy M01 Core,5,Great product,Nice product sir,Bikash Kure,Nagaon District,2 months ago,0,0
1166,AICFNNBW9EB2S9ZA,Symphony 55 L Tower Air Cooler,1,Not recommended at all,"Don’t buy this product any more only looking wise good ,not cooling good only blowers,,,,,bad bad bad",Fawad Ahmad,Nawada,"Jun, 2020",1,0
339,ACCGFWY2ARNJDAJG,GadgetM Back Cover for Apple Iphone 12,5,Perfect product!,Nice,Bandari Ugander,Sangareddy,1 month ago,0,0
150,CKBET6WU5APC49HS,BRITANNIA NutriChoice Digestive High Fibre Biscuits Digestive,5,Excellent,Very good 😊,Jayanti  Patra,Pimpri Chinchwad,1 month ago,0,0
1255,AICEQUFHVJGGHPMV,Symphony 35 L Tower Air Cooler,1,Don't waste your money,The product isn't good.neither is the cooling and the worst part is that Flipkart won't even give me a refund to order a bigger size that could actually meet the requirement and that too after the seller has forwarded a refund report.,Abhisek  Khandelwal,New Delhi,"Jun, 2018",0,0
1357,AICESQCZZVR3CMBM,Symphony 55 L Room/Personal Air Cooler,5,Great product,Most stylish cooler in its segment. Cooling is excellent 👍,Gaurav Srivastava ,Gaya,"Jun, 2019",18,3
1239,AICEQUFHVJGGHPMV,Symphony 35 L Tower Air Cooler,5,Worth every penny,nice product,Alok Pattnaik,Bhubaneswar,"Jun, 2019",3,1
193,ACCFRWVBWVBHHCXG,"KWINE CASE Back Cover for Samsung Galaxy F41, Samsung Galaxy M31, Samsung Galaxy M21 2021",4,Good quality product,Really a good case and value of money,Bhushan Savarkar,Nagpur District,3 months ago,0,0
1043,AICFYNGFPPNRM8FG,Symphony 27 L Room/Personal Air Cooler,4,Wonderful,Good for single person,Ajay  Thakur,Chandigarh,9 months ago,12,5
1034,AICGC6YYNZJHZTCA,CROMPTON 75 L Desert Air Cooler,5,Brilliant,Best cooler air delivery high. Other cooler air delivery v bad but this cooler is best....,Diljot Singh Singh,Sunam,"May, 2018",30,10
745,AICFERMY7WWWAZYZ,Hindware Calisto 50 L Desert Air Cooler,1,Horrible,After 15days water pump stopped working,Bittu Rana,Jamshedpur,11 months ago,5,1
5,ACCFZUG7KF9ATX9H,"Casotec Back Cover for Samsung Galaxy M12, Samsung Galaxy A12, Samsung Galaxy F12 Clear TPU Case",5,Simply awesome,"Quality of product as good value for money , packing was little bit poor but over all nice product at this range.",Shiw Kumar Tiwary ,Latehar,9 months ago,1,0
197,ACCFDK469A9W96HJ,ZEBRONICS Zeb-K20 Wired USB Desktop Keyboard,3,Decent product,"Nice product at rs-330, it quite smooth",Siddharth Gope,Saraikela Kharsawan District,"Aug, 2020",3,0
7,ACCFZUG7KF9ATX9H,"Casotec Back Cover for Samsung Galaxy M12, Samsung Galaxy A12, Samsung Galaxy F12 Clear TPU Case",5,Awesome,Best transparent cover ❣️,Himanshu Sharma,Saran District,13 days ago,0,0
383,AICFFVVJFQHHNCN8,CROMPTON 88 L Desert Air Cooler,1,Horrible,very bad proudect,Meraj Khan,Loni,9 months ago,1,0
543,ACCG7FRJSUGRH6XC,Flipkart SmartBuy Back Cover for Samsung Galaxy M30,5,Great product,Nice,Muthu  Kumar,Sedapatti,2 months ago,0,0
52,ACCFZUG7KF9ATX9H,"Casotec Back Cover for Samsung Galaxy M12, Samsung Galaxy A12, Samsung Galaxy F12 Clear TPU Case",2,Could be way better,Not so good,RAKESH MONDAL,Taki,5 months ago,0,0
156,ACCEZ3YWU75CERHH,ZEBRONICS ZEB-KM-2100 Wired USB Desktop Keyboard,4,Pretty good,Good product as per price.,Priyesh  Jha,Patna,"Jan, 2018",1,0
81,ACCGFCHVGTWSHZYU,GadgetM Back Cover for Apple iPhone XR,1,Horrible,Camera fitting is not proper,Aakash  Ranjan,Dehradun,6 months ago,0,0
221,ACCFX6XRVG54GWXH,"Casewilla Back Cover for Apple iPhone 12, Plain, Cover",4,Value-for-money,Good looking,Md shahjada Ansari,Garhwa,4 months ago,0,0
522,ACCGCP26PPRQFPEQ,SHINESTAR. Back Cover for Samsung Galaxy F23 5G,5,Must buy!,Good 👍,ayan Malakar,Nadia District,6 days ago,0,0
361,ACCGFWY2ARNJDAJG,GadgetM Back Cover for Apple Iphone 12,4,Really Nice,Very nice it fits well,Nining  Ranglong ,Hailakandi,3 months ago,0,0
612,ACCEGVTXGKZDXFRX,AMKETTE Xcite Neo Mouse & Wired USB Laptop Keyboard,5,Quality for its price,"Keyboard Pros:1. Good key spacing.2. I like the spring loaded feel while pressing the Space key.3. Long Shift and backspace keys are helpful.4. Blue arrow keys seem kinda cool. Keyboard Cons:1. The Hot keys are made of rubber so its unpleasant to use.2. The num,caps and Scroll lights are a bit dim. Mouse Pros:1. It has 1000dpi, enough for regular tasks.2. The mouse is slightly raised, so it fits in my hands perfectly. Mouse cons:1.The Scroll wheel is very soft and needs care wh...",Amarta Dey,Habra,"May, 2016",134,13
150,ACCFRWVBWVBHHCXG,"KWINE CASE Back Cover for Samsung Galaxy F41, Samsung Galaxy M31, Samsung Galaxy M21 2021",4,Worth the money,Just awesome 😎,Karan Shivade,Dhule District,9 days ago,0,0
86,ACCEZ3YWU75CERHH,ZEBRONICS ZEB-KM-2100 Wired USB Desktop Keyboard,5,Terrific,Great Buy....nice quality product by zebronics...keywords are not hard ;easily accesable....just plug and play...everything works perfectly.....typing is supersmooth..loved it...,AMIT SAHA,Kolkata,"Aug, 2019",17,4
334,ACCFVFZGBTVJZYJG,Case Club Back Cover for Samsung Galaxy M01 Core,5,Mind-blowing purchase,Two_Good cover,Ankit Patel,Daman,1 month ago,0,0
258,ACCFBZGVBKU3MNFY,HP 100 Wired USB Desktop Keyboard,3,Fair,Its better now days to go for bluetooth keyboard and mouse combo rather than this plus laptops now days come with very few USB ports so if need keyboard mouse wired separately you may not be able to connect anything else as i had 2 use port.. Although this poroduct is farely good. Didn't have any complaints but it's old tech now... Go for bluetooth keyboard and mouse combo... Its will be little  costly but worth it.,Ranjan Priye,New Delhi,"May, 2020",1,1
666,ACCG7RFFZFDBKQ56,Cover Alive Back Cover for Apple iPhone 13,5,Wonderful,Good,Tharindu Lakshan  Jayasinghe,Bengaluru,25 days ago,0,0
684,ACCDTR26KZZMSB57,HP x500 Wired Optical Mouse,4,Nice product,Good and nice prodict look wise also good its hardy i use in windows7 so i can not say that it support windows10 or not otherwise good product thanks HP,Israr Alam,Kolkata,"Dec, 2017",1,0
18,ACCGFWY43WADZC5E,GadgetM Back Cover for Apple Iphone 12,4,Good quality product,Ok,Munna Shaik,Vijayawada,20 days ago,0,0
303,ACCE94WY6QPXKXFN,HP C2500 Wired Combo keyboard and Mouse,5,Terrific purchase,Keyboard quality is very good ....Buttons are very smooth ...Weight less product ...Mouse is very good quality & smoothly working ...overall very good product ...I am totally satisfied to by this product  ....,Sathish Kumar,Tiruchirappalli,"Apr, 2017",156,35
542,ACCF47WBREUAVYHH,SHINESTAR. Back Cover for Apple iPhone 6s,5,Worth every penny,Very good product,Meera  Devi,Khaga,3 months ago,0,0
327,ACCGFWY2ARNJDAJG,GadgetM Back Cover for Apple Iphone 12,5,Simply awesome,Awesome 👌👌,Alishan Mollah,Sankrail,25 days ago,0,0
681,AICEQUFHBKNF5U4T,Symphony 12 L Room/Personal Air Cooler,2,Bad quality,jest ok,Pyla Ramana,Hyderabad,"Feb, 2019",6,1
226,AICFFGJZTHSDN3AZ,Symphony 27 L Room/Personal Air Cooler,4,Really Nice,Good product.cools the room very quickly.plastic quality could have been better.noise is not much,Shantanu Nivekar,Pune,"May, 2019",2,0
718,AICFERMY7WWWAZYZ,Hindware Calisto 50 L Desert Air Cooler,5,Perfect product!,"Writing the review after using 2 weeksIt's durable,ita fiber material so would be light weight but doesnt mean it will break. Use it with pump if you want to use this indoor and thia will perfectly cool your rooms. Don't use without the pump as it will take all the heat from the kitchenPerfect product. Thank you flipkart for great one.Just a single thing which could have been better will be delivery. I was delivered after 6 days.",Ritu Sharma,New Delhi,11 months ago,2,0
295,AICGYH26HGMFGEBF,Hindware Snowcrest 45 L Room/Personal Air Cooler,4,Very Good,It would be great if they would have provided ice chamber with it.,Dr suraj Amber,Pimpri Chinchwad,"Mar, 2021",2,0
16,ACCGFWY43WADZC5E,GadgetM Back Cover for Apple Iphone 12,3,Nice,"It is a fine cover, but beware it is not a Silicone case cover.",YATK BUDHRANI,Lucknow,18 days ago,0,0
284,ACCEQH83EUNCY3CV,SHINESTAR. Back Cover for Apple iPhone 6s,5,Simply awesome,Amaging products,Seikh Sahidul,Purba Bardhaman District,"Aug, 2020",0,0
325,ACCG69QFS8M7WF8V,NKCASE Back Cover for Samsung Galaxy M32 5G,3,Just okay,Ok,BALACHANDRA  NAIK,Bengaluru,2 months ago,0,0
1016,AICGC6YYNZJHZTCA,CROMPTON 75 L Desert Air Cooler,5,A1 worth for every penny,Bought 2 cooler 1 by 1 gap of 2 weeks. Cooling amazing . No need of stand coz of standerd hight compact size . Have ice chamber. And strong body.,AMIT  SACHAN ,Begusarai,"Apr, 2018",1,1
690,AICEQUFHBKNF5U4T,Symphony 12 L Room/Personal Air Cooler,5,Great product,Good product for this price,GIRJA SHANKAR HARIJAN,Konnagar,"May, 2018",13,5
177,AICFFGJZTHSDN3AZ,Symphony 27 L Room/Personal Air Cooler,1,Very poor,Never buy this product... Once you baught it.. U can only replace it. But can't return it. U must have to use this company's product. If u call on flipkart they will not hear your voice and will do drama that I am not able to get your voice. I will never buy any product from flipkart from now,Krutik Joshi,Ahmedabad,"Mar, 2021",55,12
1553,AICFCMRDPJ4DK4ZD,Flipkart SmartBuy 30 L Tower Air Cooler,1,Worthless,Firstly wrong description of the productIn case you didn't like the product there is no chance of return from where you can get money seller is forcing to keep the product support team pathetic... nothing you can do with better go and buy offlin  not as good as othrs in this range,Ashish Tiwari,Lucknow,2 days ago,1,0
311,ACCGY4GMUVP9UFNS,"HUPSHY Back Cover for Samsung Galaxy M12, Samsung Galaxy F12, Samsung Galaxy A12",2,Not good,Not fit as expected,Arpit Singh Rajawat,Auraiya,5 months ago,0,0
41,ACCFZUG7KF9ATX9H,"Casotec Back Cover for Samsung Galaxy M12, Samsung Galaxy A12, Samsung Galaxy F12 Clear TPU Case",4,Pretty good,It's nice classy product,Janu K,Karad,4 months ago,0,0
634,ACCERQGMQCQFXGHC,GoldKart Back Cover for Apple iPhone 6 GOLDCASE-701,4,Worth the money,Good,Sanjeev Ranjan,Bonaigarh,"Dec, 2019",0,0
642,ACCG9BV88N3KXKJH,KartV Back Cover for Apple Iphone 11,1,Utterly Disappointed,Colours damaged,Naveen Thakur,Mumbai,1 month ago,3,0
319,ACCG69QFS8M7WF8V,NKCASE Back Cover for Samsung Galaxy M32 5G,5,Fabulous!,Good,Sijin joy,Kochi,13 days ago,0,0
430,AICFQV87NFUG595H,CROMPTON 40 L Room/Personal Air Cooler,5,Must buy!,Nice cooler at this price. Plastic quality is good. Looks good....It is working fine in a drought area like Anantapur.... Cooling is also goof Nice product ...Just go for it...,Mahesh Babu Arakala Sayam,Anantapur District,"Mar, 2021",7,4
618,AICEQVHUD9VZC4EG,Orient Electric 20 L Room/Personal Air Cooler,4,Value-for-money,"It's a nice cooler. Airthrow is quite good and speed of the blower is also very high even in the minimum speed level. Only problem is water inlet, it needs to be poured from top of the cooler and that too very slowly with a help of a mug which is little time taking.",Rahul Koushal,Cuttack,"Mar, 2021",3,1
107,ACCGYWFK2JE2BJR8,"GoldKart Back Cover for Samsung Galaxy M12, Samsung Galaxy A12, Samsung Galaxy F12",4,Value-for-money,Too good,,Patna,6 months ago,0,0
782,ACCFAHEZ9HEFPHMG,Glink GLM69 Wired Optical Mouse,5,Wonderful,Very good products,Rahul kumar Yadav,Siwan District,2 months ago,0,0
936,ACCES6YFGJFF7GFJ,QUANTUM QHM7307 MINI MULTIMEDIA KEYBOARD Wired USB Multi-device Keyboard,5,Perfect product!,Nice and amazing keyboard with plug and use feature,HIMANGSHU KALITA,Bongaigaon,5 months ago,0,0
358,ACCE94WY6QPXKXFN,HP C2500 Wired Combo keyboard and Mouse,5,Simply awesome,wonderful product...😍😍😍value for moneythis is great 😍😍😍,Sovan Mondal,Chakdaha,"Oct, 2019",5,0
447,AICFQV87NFUG595H,CROMPTON 40 L Room/Personal Air Cooler,5,Just wow!,Very nice cooler,Shiv shankar Sharma,Patna,9 days ago,1,0
238,ACCFBZGVBKU3MNFY,HP 100 Wired USB Desktop Keyboard,1,Did not meet expectations,Chinese Item. Not that durable. It has small keys. It is not like regular keyboard. Invest a little more and buy good keyboard.,Vijayendra Singh Rajput,Jabalpur,"Mar, 2021",2,0
69,ACCGFCHVGTWSHZYU,GadgetM Back Cover for Apple iPhone XR,4,Worth the money,It was okay,Kuldeep Brdl,Abhayapuri,2 months ago,0,0
241,ACCEQH83EUNCY3CV,SHINESTAR. Back Cover for Apple iPhone 6s,4,Very Good,Very nice,Rahul raj,Asankhurd,7 months ago,1,0
124,CKBET6WU5APC49HS,BRITANNIA NutriChoice Digestive High Fibre Biscuits Digestive,5,Worth every penny,Good,Pankaj Gupta,Aligarh,8 days ago,0,0
951,AICERF3ZUEZPUWFK,Hindware 36 L Room/Personal Air Cooler,1,Waste of money!,One sided exas no cooling effect bad product,Tatyarao Pere,Aurangabad,"Jun, 2020",2,0
173,ACCFDK469A9W96HJ,ZEBRONICS Zeb-K20 Wired USB Desktop Keyboard,5,Fabulous!,Good QualityThis product Quality is good.😉,Dhaneswar Mallik,Cuttack,"Nov, 2020",63,7
1437,AICEQVHUGDDBYF6K,Orient Electric 50 L Window Air Cooler,4,Value-for-money,"Product is good after 3 hours running time it can't control room humidity , delivery is super fast only 2 days take from booking and delivery person behaviour is very good.",Rajesh  paital,Kendrapara,10 months ago,9,4
1207,AICEQUFHVJGGHPMV,Symphony 35 L Tower Air Cooler,1,Useless product,Really very satisfied with the Ekart services for delivering early but not satisfied with the product.. It looks like a refurbished one and all the locks for back panel are broken.. Cant even request a return as am out of station and will be back in a week or may be later,Arif Azam ,Jehanabad,"Jul, 2018",91,70
721,ACCDTR26KZZMSB57,HP x500 Wired Optical Mouse,5,Must buy!,Very good product. It is very smooth. I liked this product.,Ujjal Gogoi,Dibrugarh District,2 months ago,0,0
655,ACCG9BV88N3KXKJH,KartV Back Cover for Apple Iphone 11,5,Classy product,Best quality 👍👍👍👍,Pratik Rathod,Valsad District,1 month ago,0,0
516,ACCF47WBREUAVYHH,SHINESTAR. Back Cover for Apple iPhone 6s,5,Best in the market!,very good product and my phone is looking very nice,vishnu ram. S,Mettur,"Jun, 2019",2,0
543,ACCF5Q2FBDBUZPAU,"Logitech M221 / Silent Buttons, 1000 DPI Optical Tracking, Ambidextrous Wireless Optical Mouse",5,Awesome,Very Nice 😍😍👍,Sandeep Kumar,Rajgir,6 months ago,1,0
542,AICEQGBHB75HSWGG,CROMPTON 75 L Desert Air Cooler,5,Best in the market!,Excellent Product... Excellent delivery... Specially excellent behavior of Delivery Agent... Noise is very low... fully satisfied... 10 out of 5... I am from West Bengal and there is not any single scratch on the product due to delivery reason... Excellent... No leakage issue in honeycomb pad... everything is fine... bohot dino ke bad chain se sone ko mila yaar... Just fill up 75 liter tank with 4 to 5 large bucket of water and enjoy... Special Warning : Don't switch on the pump regulator wit...,Shaswata Mukherjee,Burdwan,"May, 2019",25,3
17,ACCFZUG7KF9ATX9H,"Casotec Back Cover for Samsung Galaxy M12, Samsung Galaxy A12, Samsung Galaxy F12 Clear TPU Case",5,Terrific,Good 👍,Deeparam  Suthar ,Navi Mumbai,1 month ago,0,0
441,ACCFBDCVVNXUWBXH,ZEBRONICS Zeb-Judwaa 750 Keyboard & Mouse Combo Wired USB Desktop Keyboard,5,Worth every penny,Awesome,Raja S,Erode,17 days ago,0,0
392,ACCFBDCVVNXUWBXH,ZEBRONICS Zeb-Judwaa 750 Keyboard & Mouse Combo Wired USB Desktop Keyboard,5,Awesome,Good keyboard best price,Piyush Aneja,New Delhi,5 months ago,5,0
211,ACCGFXRUUQEYMRKA,"CEDO Flip Cover for Samsung Galaxy F12, Samsung Galaxy M12, Samsung Galaxy A12",5,Terrific,Awesome,Ganesh p bhooshan,Kollam District,1 month ago,0,0
169,CKBET6WU5APC49HS,BRITANNIA NutriChoice Digestive High Fibre Biscuits Digestive,5,Highly recommended,Thanks Flipkart exlant product,Amit Kumar thakur,Bhagalpur District,3 months ago,0,0
898,ACCES6YFGJFF7GFJ,QUANTUM QHM7307 MINI MULTIMEDIA KEYBOARD Wired USB Multi-device Keyboard,5,Best in the market!,Good Product,Aneesh  R,Kozhenchery,22 days ago,0,0
6,ACCGFWY43WADZC5E,GadgetM Back Cover for Apple Iphone 12,4,Very Good,Nice product and nice material 👌👌👌,Antim Mitwal,Ashta,2 days ago,0,0
